StoryID,GroupOrder,ViewOrder,NameJP,PhraseJP,NameEN,PhraseEN
26420105,32,1,,気持ちいいことしか考えられないように。\nもっと、快楽に溺れてしまうように。\n柔らかな乳房を揉み、汗ばんだうなじを舐め、突き上げる。,,"I make it so that all she can think about is how good it feels. More, so that she can drown in the pleasure. I squeeze her soft breasts, lick the nape of her sweaty neck, and thrust upward."
26420105,33,1,ヴェローナ,「車掌さん、車掌さぁん……それ、すごい、あぁ……」,Verona,"Conductor, Conductor...that's amazing, ahhh...!"
26420105,34,1,,竿全体を包み込みながら、もっと奥へと誘うように\n膣内が激しく動き始めた。\n彼女の蜜汁が太ももにまで垂れている。\n立ち上ってくる甘い香りに、脳の奥まで溶かされるようだった。,,"Her vagina starts to move hard as she wraps my entire rod in it, inviting me to go deeper. Her honey is dripping down to her thighs. The sweet scent that rises up seems to melt her brain."
26420105,35,1,ヴェローナ,「わ、私……、きちゃう……！\n　んっ、今度は、車掌さん……も、一緒、に、ね？」,Verona,"I-I'm...gonna cum...! Hnn, cum with me...Conductor...!"
26420105,36,1,ヴェローナ,「うふふ、嬉しいわ。約束……、約束、よ？\n　んんっ、ちゅっ……、ふぁ、あん……」,Verona,"Fufu, I'm glad. Promise...promise, okay?\nHnn, chuu...fwahh, ann...!"
26420105,37,1,,一度彼女に口付けてから、今にも爆ぜそうなのをぐっと堪えて、\n彼女を再び高みへと導くために、腰を大きく突き動かした。,,"Once I kiss her on the mouth, I gulp as if I'm about to explode\nand thrust my hips wide to bring her to another height."
26420105,38,1,ヴェローナ,「あああっ、あ、あ！　私……ほんとうに、もう、もうっ……！」,Verona,"Ahhh, ah, ah! I'm...I'm really gonna...!"
26420105,39,1,,力強い抽送を受け、ヴェローナは快感に震えながら目をつぶった。,,"Verona closes her eyes,\nshivering with pleasure as she receives a powerful thrust."
26420105,40,1,ヴェローナ,「ひ、ひぁ、あ……、車掌さん、一緒にぃ……！\n　私の中に、全部、ちょうだい……っ」,Verona,"Hee, haa, ahhh...Conductor, cum with me...!\nFill me with your cum...!"
26420105,41,1,ヴェローナ,「あ、あぁ、駄目……もう……イっちゃうっ」,Verona,"Ahh, ahh, oh no...I'm...gonna cum!"
26420105,42,1,,がくんがくんと、全身を揺らしてヴェローナは果てた。\n同時に、ペニスの先から熱い精液が彼女の中に弾けていった。,,"Verona's body shakes as she reaches climax. \nAt the same time, hot semen shoots out of my tip and into her."
26420105,43,1,ヴェローナ,「はぁ……、あ……んんっ」,Verona,Haa...ahhh...hnnn...
26420105,44,1,ヴェローナ,「車掌さんの……、私のココに、いっぱい出てるわ。\n　奥の方まで、あったかいのが広がってるの……」,Verona,Conductor...you came so much in my pussy.\nIt's warm all the way to the back...
26420105,45,1,,ヴェローナは恍惚とした表情で、吐き出された熱を感じていた。\n愛おしさが押し寄せてきて、彼女の指先にそっと手を伸ばす。\n身体はひとつに繋がったまま、ゆっくりと指を絡めた。,,"Verona is in ecstasy, feeling the heat of the exhalation. A feeling of love washes over me and I gently reach for her fingertips. Our bodies remain connected as one, and we slowly intertwine our fingers."
26420105,46,1,ヴェローナ,「……ねぇ、車掌さん。\n　もう少しだけ、このままでいさせて？」,Verona,"...Hey, Conductor.\nCan we just stay like this for a little while longer?"
26420105,47,1,,ヴェローナの言葉に、もちろんと答えながら\n彼女の手をぎゅっと握りしめた。,,I squeeze her hand as I answer of course.
26430104,1,1,,放課後、あることに気が付いた。\nいつもなら外を歩いていると、ヴェローナの歌声が聞こえてくるのに\n今日はやけに静かだった。,,"After lessons, I notice something. Normally, when I walk outside, I can hear Verona singing, but today it's awfully quiet."
26430104,2,1,,もしや……、明日雪でも降るんじゃないか？,,Is it...going to snow tomorrow?
26430104,3,1,,不思議に思っていると、\n花壇の傍にしゃがみ込むヴェローナの姿を見つけた。,,"As I ponder, I spot Verona crouching by a flower bed."
26430104,4,1,ヴェローナ,「こんにちは、車掌さん。今日はとってもいい天気ね♪」,Verona,"Hello, Conductor. It's a very nice day today."
26430104,5,1,,声をかけると、パッと明るい笑顔を向けられた。,,"When I call out to her, she gives me a quick, bright smile."
26430104,6,1,,特に変わった様子はなさそうだが……。\n歌声が聞こえなくて驚いたことを告げると\nヴェローナは少し照れたように笑った。,,She doesn't seem to look any different... She smiles a little embarrassedly when I tell her I was surprised I couldn't hear her singing.
26430104,7,1,ヴェローナ,「実は、昨日の夜発声練習を頑張り過ぎたみたいなの。\n　つい、楽しくて……少し、喉を痛めてしまったのよ」,Verona,"Actually, I think I worked too hard on my vocal exercises last night.\nI was having so much fun that I hurt my throat a little bit."
26430104,8,1,ヴェローナ,「だから、今日は歌はお休みなの。\n　身体をしっかり休めて、明日からまた元気に頑張らなきゃ」,Verona,That's why I'm not going to sing today.\nI have to rest my body well and start working hard again tomorrow.
26430104,9,1,,ヴェローナはそう言うと、突然勢いよく立ち上がった。,,"Verona speaks, and suddenly stands up vigorously."
26430104,10,1,ヴェローナ,「ああっ、この痛みが泡になって消えた『人魚姫』のように、\n　恋の炎に焦がれて生まれた痛みなら、どれほど素敵だったのでしょう！」,Verona,"Oh, how lovely it would be if this pain had been born of the fire of love,\nlike in The Little Mermaid, who vanished in a bubble!"
26430104,11,1,,演劇スイッチが入ったヴェローナを、\n喉が痛いなら無理をしないように、と諭す。,,"I tell Verona, who has her theatrical switch turned on,\nto take it easy if her throat hurts."
26430104,12,1,,今日は身体を休める日という彼女に、何か出来ることはないだろうか。\n少し考えた後、マッサージをしてあげようかと提案をしてみた。,,"I wonder if there's anything I can do for her today, when she says it's a rest day. After thinking about it for a while, I suggest that I give her a massage."
26430104,13,1,ヴェローナ,「まあっ！　お願いしてもいいのかしら？」,Verona,Oh! Can I ask you to do that?
26430104,14,1,,目を丸くして驚くヴェローナに、もちろんと答える。,,I roll my eyes at Verona's surprise and say of course.
26430104,15,1,ヴェローナ,「嬉しいわ！　それじゃあ、私の部屋に行きましょう♪」,Verona,I'm so happy! Let's go to my room then...
26430104,16,1,,ヴェローナの部屋に到着するや否や、彼女をうつぶせに寝かせ\n早速背中のマッサージから始めることに。,,"As soon as we arrive at Verona's room,\nI lay her down on her back and start with a back massage."
26430104,17,1,ヴェローナ,「きっと車掌さんなら、すぐによくしてくれるわね」,Verona,"I'm sure you'll make me feel better right away, Conductor."
26430104,18,1,,期待に応えるように、指や手の平を使ってマッサージをしていく。,,"To meet expectations, I massage with my fingers and palms."
26430104,19,1,,肩を揉み、肩甲骨の辺りをぐいっと押し込んだ後は\nそのまま背骨に沿うように、手の下の方を使って揉み込んでいった。,,"I rub her shoulders, and after pushing in hard around her shoulder blades,\nI go straight to rubbing along her spine, using the lower part of my hands."
26430104,20,1,ヴェローナ,「うふふっ、やっぱり車掌さん、すっごく上手ね」,Verona,"Mmmm, you're really good at that, Conductor."
26430104,21,1,,早く元気になって、また歌声を聞かせてほしいからな。,,"I hope you get well soon,\nbecause I want to hear you sing again."
26430104,22,1,ヴェローナ,「まあ！　早く治して、最高の歌声をあなたにプレゼントしないとね♪」,Verona,Yeah! I have to get well soon and give you my best singing voice\u266a
26430104,23,1,,彼女が歌っている姿に想いをはせながら、\nマッサージを繰り返すのだった。,,"I repeat the massage, thinking of her singing."
26430105,1,1,,一通り肩と背中のマッサージを終え、下半身の筋肉を解そうと\n手を下へ滑らせていた、その時――,,"After finishing the shoulder and back massage, I slide my hands down to release the muscles in her lower body. Then..."
26430105,2,1,ヴェローナ,「あっ……」,Verona,Ah...
26430105,3,1,,ちょうど、脚の付け根に触れた瞬間に\nヴェローナの口から、甘い声が漏れた。,,"Just as I touch the base of her leg,\na sweet sound escapes from Verona's mouth."
26430105,4,1,ヴェローナ,「あっ、い、今のは違うのよ？\n　ちょっと、くすぐったかっただけで……」,Verona,"Oh, t-that wasn't what I meant, okay?\nI was just ticklish, that's all..."
26430105,5,1,,無意識だったのだろう。\n動揺するヴェローナは必死に誤魔化そうとしていたが、\nもう一度同じ場所に触れると、,,"It must have been unconscious. Verona is desperately trying to cover it up, but when I touch the same spot again..."
26430105,6,1,ヴェローナ,「んっ、ふっ……あ！　ああんっ」,Verona,"Hnn, fuu...ahh! Annn!"
26430105,7,1,,先程よりも大きな声が漏れ出た。,,"Moans leak out, louder than before."
26430105,8,1,,悪戯心が芽生え、肝心な場所へ手を伸ばさないまま\n彼女の太ももを手の平全体を使って、マッサージし始めた。,,"Mischief sets in, and I start to massage her thighs\nwith the entire palms of my hands, without reaching for her vital spot."
26430105,9,1,,時折、きわどい場所へ指を近付けると\nふるりと、彼女の脚が小さく揺れた。,,"When I occasionally bring my fingers to that racy spot,\nher legs shake a little."
26430105,10,1,ヴェローナ,「車掌、さん……」,Verona,Conductor...
26430105,11,1,,もっと触って欲しいと言いたげに、ヴェローナに視線を向けられる。\nそのまま流れるように顔を近付け、彼女に口付けた。,,Verona looks at me as if to say that she wants me to touch her more.\nI move my face closer to hers and kiss her.
26430105,12,1,ヴェローナ,「ちゅっ、んあ……、ちゅっ、んん、……ふぁっ……はぁ、んっ」,Verona,"Mwah, naah...mwah, hnn...fwah...haa, hnn..."
26430105,13,1,,段々と深くなっていくキスに夢中になる。\n舌先を絡めながら、服を脱がし時間ももどかしく\n彼女の服の中に手を差し込んだ。,,"I get carried away in the kiss that gets deeper and deeper. While twirling the tip of my tongue, I put my hand inside her clothes, frustratingly taking time to take them off."
26430105,14,1,ヴェローナ,「え？　あ、車掌さん、もう入れちゃ……、あぁっ」,Verona,"Eh? Oh, Conductor, you're putting it in...ahhh!"
26430105,15,1,,指で数回、彼女の膣内を擦りあげてから\n熱のこもった竿を、後ろから矢継ぎ早に挿入した。,,I rub my fingers up and down her pussy a few times\nbefore inserting my hot rod into her from behind in rapid succession.
26430105,16,1,ヴェローナ,「ああぁっ……、おっきいのが、んっ、入ってくるぅ……！」,Verona,"Ahhh...Your big dick is, hnnn, inside me...!"
26430105,17,1,,普段よりも短い愛撫だったが、彼女の中は蜜で満たされており\nぐちゅりと湿った音が、ヴェローナの部屋に響いている。,,"Foreplay was shorter than usual, but her insides are filled with nectar, and a wet, gurgling sound echoes through Verona's room."
26430105,18,1,,まさかもう入れられるとは思っていなかったのか、\nヴェローナは驚いた表情を浮かべながら、短く呼吸を繰り返した。,,"Maybe Verona didn't think I could go any farther,\nso she talks with short breaths while looking surprised."
26430105,19,1,ヴェローナ,「はぁ、は、車掌さん……、ん、あぁ、は……や、っあ、んん」,Verona,"Haa, ha, Conductor...hnn, ahh, haa...yah, ah, hnnn!"
26430105,20,1,,ゆるゆると律動を始めると、感じ入るようにまた声を上げた。,,"As I begin to get into a loose rhythm,\nshe raises my voice again as if she can feel it."
26430105,21,1,,柔らかな双丘に手を伸ばし、手で包み込むようにして揉んでいく。\nマッサージの延長のようにも、本能的な動きのようにも見えた。,,"I reach out and rub her soft twin hills, cupping them in my hands.\nIt looks like an extension of the massage or an instinctive move."
26430105,22,1,ヴェローナ,「あっ、やっ……、そんな、胸も一緒になんてずるいわ……」,Verona,"Ah, yaah...\nit's not fair to touch my boobs at the same time like that..."
26430105,23,1,,首を僅かに後ろに仰け反らせながら、ヴェローナは声を震わせた。,,Verona's voice trembles as she turns her head back slightly.
26430105,24,1,ヴェローナ,「はぁん！　ゆっくり動かれたら……、私の中……っ、\n　車掌さんの形になっちゃう……」,Verona,Haaan! If you move slowly...my insides...\nwill take the shape of your dick...
26430105,25,1,,膣壁全体が竿を包み込んでくる。,,Her entire pussy wraps around my rod.
26430105,26,1,,自分の形になってしまえばいいと思いながら、\n入口から奥までを堪能するように、腰を動かした。,,"I move my hips so that I can enjoy it from the entrance to the back,\nhoping to make it take my shape."
26430105,27,1,ヴェローナ,「あぁ、……車掌さん、だめ、よ。だめ……なのぉ」,Verona,"Ahhh...Conductor, no. No...ahh!"
26430105,28,1,,快楽に飲み込まれないように、腰を逃がすヴェローナ。\n彼女が動いた分だけ腰を大きくグラインドさせ、\n更に深い快楽へと突き落とす。,,"Verona pulls her hips back so as not to be swallowed by the pleasure. The more she moves, the more I grind my hips and push off into even deeper pleasure."
26430105,29,1,ヴェローナ,「あぁっ、あっ……ん！　んんっ！　あっ、んぁ、ああぁあ！」,Verona,"Ahh, ah...hnn! Hnn! Ah, naah, ahhh!"
26430105,30,1,,竿の先が子宮口へぶつかった瞬間、\nヴェローナは一際大きな声で喘いだ。,,"The moment the tip of my rod hits her cervix, Verona gasps loudly."
26430105,31,1,,同時に、乳首を少し痛いぐらいにつねると,,"At the same time, I pinch her nipples to the point that it hurts a little."
26430105,32,1,ヴェローナ,「ひゃっ、あぁん！　あっ、いい……いいのっ！\n　車掌さんのが奥まで届いて、あっ、あん！」,Verona,"Hyaah, annn! Ah, good...so good!\nConductor, your dick is all the way in, ah, ann!"
26430105,33,1,,タカが外れたように、ヴェローナは嬌声を上げた。\nその声をもっと聞きたくなり、今度は竿を彼女の中に埋め込んだまま\n亀頭で子宮口をぐいっと強く押し付ける。,,"As if she has been caught off guard, Verona lets out a squeal of delight. I want to hear more, so I keep my dick inside her and press hard against her cervix."
26430105,34,1,,一瞬呼吸が止まったヴェローナが、再び荒い吐息を吐き出すのと共に\n結合部からどろりと蜜汁があふれ出した。,,"After her breath hitches, Verona lets out a ragged breath again,\nand honey flows out of her pussy."
26430105,35,1,ヴェローナ,「ん、ふぁ、車掌さん……、車掌さん！　はぁ、あぁ、……あっ」,Verona,"Hnn, fwah, Conductor...Conductor! Haa, ahh...ahh!"
26430105,36,1,,激しく突き動かすと、ヴェローナの身体が衝撃で前後に揺れ動いた。\n彼女の中から抜けるぎりぎりまで腰を引き、\n勢いよく奥へと挿入する。,,"With a violent thrust, Verona's body rocks back and forth in shock. I pull my hips back until I'm just about out of her and thrust deep into her with great force."
26430105,37,1,ヴェローナ,「あっ、ああっ！　だめぇ、こんなのすぐ、すぐイッちゃう……！」,Verona,"Ah, ahhh! Oh God, I'm gonna cum so fast like this...!"
26430105,38,1,ヴェローナ,「あっ、ふあぁ、あぁ、……あぁんっ、んん！\n　奥、おくぅ……っ、そ、そんなに押し付けられたら、あぁああ！」,Verona,"Ah, fwah, ahh...ann, hnn! S-so deep...\nI had no idea you could go that far, ahhh!"
26430105,39,1,,膣内が大きく蠢き、精液を絞り出そうとしているようだった。,,Her vagina is sloshing loudly\nand seems to be trying to squeeze out my cum.
26430105,40,1,,限界が近い彼女の耳元で、我慢するように囁く。\nヴェローナは耐え難いとでも言うように、首を横に振り唇を噛みしめた。,,I whisper in her ear that I'm nearing my limit and to be patient.\nVerona shakes her head and bites her lip as if to say it's unbearable.
26430105,41,1,ヴェローナ,「んんっ、ふぁ……、が、我慢なんて……\n　出来るわけない、じゃな……あぁっ」,Verona,"Hnn, fwah...i-it's not that...I can't be patient...ahhh!"
26430105,42,1,,そう言いながらも、シーツをぎゅっと握りしめて耐えている姿が\nあまりにも健気で可愛らしく見えた。,,"Even as she says this,\nthe way she clutches the sheets and endures looks so cute."
26430105,43,1,ヴェローナ,「お願いっ……、車掌さん……あぁっ！」,Verona,Please...Conductor...ahhh!
26430105,44,1,,泣きそうな声で懇願される。\n彼女が何を求めているかすぐにわかったが、\nわざと知らない顔をして焦らした。,,"She begs me in a voice that sounds like she is about to cry. I know immediately what she wants, but I deliberately put on a face of ignorance and impatience."
26430105,45,1,ヴェローナ,「んんっ、車掌さん、ったら……意地悪、あぁん！\n　また急に激しくしちゃっ……、んん、あぁっ」,Verona,"Hnnn, Conductor, you're...so mean, annn!\nYou're being so intense suddenly...hnn, ahhh!"
26430105,46,1,,ヴェローナが話し始めた瞬間、これまでよりも激しく抽送を続けた。\nそれは快感を彼女の脳へ届けていき、\n彼女の身体がびくりと跳ねた。,,"The moment Verona starts to speak, I continue to thrust harder than ever before. It delivers the pleasure to her brain, and her body jumps."
26430105,47,1,ヴェローナ,「お願い、車掌さんっ、イかせてぇ……っ。\n　イかせてちょうだいっ……！」,Verona,"Please, Conductor, make me cum...\nPlease make me cum...!"
26430105,48,1,,ヴェローナの言葉に、夢中でピストンを繰り返す。\n彼女の蜜と自身の先走りが混ざり、泡だった液体が\n真っ白なシーツに染みを作っていた。,,"At Verona's words, I madly repeat my pistoning. Her nectar mixes with my own pre-cum and the bubbling liquid makes a stain on the plain white sheets."
26430105,49,1,ヴェローナ,「あっ、あぁ……！　イく、イっちゃ……、ふあああぁあああっ！」,Verona,"Ah, ahh...! I'm cumming, I'm cum...fwaaaah!"
26430105,50,1,,ヴェローナは高い声で果てていく。\n全身をがくがくと痙攣させる彼女の膣奥に、\n白濁を思いっきり吐き出した。,,Verona cums with a high-pitched scream. I spit the white slime into her pussy with all my might as her body wriggles and spasms.
26430105,51,1,ヴェローナ,「はぁ、……はぁ、はぁ……」,Verona,"Haa...haa, haa..."
26430105,52,1,,一瞬意識を飛ばしかけたヴェローナは、\n痙攣が治まると、大きく息を吸い始めた。,,"Verona nearly loses consciousness for a moment,\nbut when the spasms subside, she starts to breathe heavily."
26430105,53,1,ヴェローナ,「……我慢なんてできるわけ、ないでしょ？」,Verona,...How could I possibly be patient?
26430105,54,1,,唇をつんととがらせて、こちらを見上げて来た。\nそれすらも可愛く見えて、思わず微笑むと「もう」と\n小さくヴェローナも笑った。,,"Verona looks up at me with her lips pouting.\nWhen I smile at her, she laughs, too."
26430105,55,1,ヴェローナ,「ねえ車掌さん、少し休んだら、お花にお礼を言いに行ってもいいかしら？\n　お話に付き合ってくれてありがとうって、お礼が言いたいの」,Verona,"Hey, Conductor, when we get some rest, can I go and thank the flowers?\nI want to say thank you to them for taking the time to talk to me."
26430105,56,1,,柔らかな笑みを浮かべるヴェローナ言葉に頷き、\n彼女の額にそっと口付けを落とした。,,I nod at Verona's words with a soft smile\nand gently drop a kiss on her forehead.
26440104,1,1,ヴェローナ,「ら～、ららら～、らら～♪」,Verona,La la la la la la la\u266a
26440104,2,1,,広い体育館にヴェローナの美声が反響する。,,Verona's beautiful voice reverberates in the large gymnasium.
26440104,3,1,,新しい劇の稽古だろうか。\n用事も忘れて思わず見入ってしまった。,,"I wonder if she's rehearsing for a new play.\nForgetting my business, I can't help looking."
26440104,4,1,ヴェローナ,「らら～、ららら～♪\n　……うーん、何か違う気がするのよね」,Verona,La la la la la~\u266a Hmm...something's off.
26440104,5,1,,虚空を見上げて渋い表情を浮かべる彼女へ、\nタイミングを見計らって声をかけた。,,"Looking up at the emptiness with a reluctant expression on her face,\nI call out to her at the right time."
26440104,6,1,ヴェローナ,「あら、車掌さん？\n　こんなところで会うなんて、何かご用事かしら？」,Verona,"Oh, Conductor?\nWhat're you doing here? Is there something I can do for you?"
26440104,7,1,,確かに用事はあるのだが、今は先ほどの渋い表情が気になる。,,"I have business to attend to,\nbut right now I'm concerned about the reluctant look on her face."
26440104,8,1,ヴェローナ,「新しい劇の稽古をしていたの。\n　今回は創作でなくって古典の恋愛作品なのだけれど、\n　どうにも歌唱部分の感情がうまく掴めなくって……」,Verona,"I was rehearsing a new play. It's not a creative one, but a classic romance, and I can't get the emotion of the singing part right..."
26440104,9,1,ヴェローナ,「そうだ、車掌さん！\n　良かったらアドバイスをいただけないかしら？」,Verona,"Oh, that's it, Conductor!\nCan you give me some advice?"
26440104,10,1,,良いことを思いついたと言わんばかりに表情が明るくなるヴェローナ。\n素人だが、こちらの意見が少しでも解決の糸口になればいいが……。,,"Verona's expression brightens as if to say she has come up with a good idea.\nI'm an amateur, but I hope my opinions can help you find a solution..."
26440104,11,1,ヴェローナ,「――っていう詩なのだけれど、どう？\n　主人公と夜空の下のデートを楽しんだ翌朝に、\n　ヒロインが自室でしっとり歌い上げるの」,Verona,What do you think of this poem? The heroine sings it in her room the morning after her date with the hero under the night sky.
26440104,12,1,,素人の読解力でもこれはきっと、その、間違いなく、\n初めての夜の想い出を赤裸々に詠ったものではないだろうか。,,"Even with a layman's reading comprehension,\nthis is definitely a poem about the memories of a first night together."
26440104,13,1,ヴェローナ,「え……ええっ！？」,Verona,Eh...ehhh!?
26440104,14,1,ヴェローナ,「初めての夜ってその、男の人と女の人の！？\n　でもこれ、星が綺麗な夜のお外のデートで……。\n　それってつまりお外で……そうだったのね！」,Verona,First night together...you mean like betweem a man and a woman!? But this was a date outside on a beautiful starry night. That means they were outdoors when...oh!
26440104,15,1,,いろいろ衝撃的だったらしく、\n目を白黒させながら真っ赤になるヴェローナ。,,"Verona seems to be shocked, and her face turns red."
26440104,16,1,ヴェローナ,「そうだと思えば確かに辻褄も合うわ。\n　なるほど、そういう詩だったのね……刺激的な夜のお話だったのね。\n　車掌さん、助かったわ。ありがとう」,Verona,"It makes sense if you think about it. So that's what the poem is about. It's a story about an exciting night. Thank you, Conductor, for your help."
26440104,17,1,,役に立てたようでよかった。,,I'm glad I could be useful.
